{
  "buttons": [
    {
      "holdDuration": 0,
      "holdProcessed": false,
      "isHeld": false,
      "pressTime": 0,
      "pressed": false,
      "releaseTime": 0,
      "wasPressed": false,
      "wasReleased": false
    },
    {
      "holdDuration": 0,
      "holdProcessed": false,
      "isHeld": false,
      "pressTime": 0,
      "pressed": false,
      "releaseTime": 0,
      "wasPressed": false,
      "wasReleased": false
    },
    {
      "holdDuration": 0,
      "holdProcessed": false,
      "isHeld": false,
      "pressTime": 0,
      "pressed": false,
      "releaseTime": 0,
      "wasPressed": false,
      "wasReleased": false
    },
    {
      "holdDuration": 0,
      "holdProcessed": false,
      "isHeld": false,
      "pressTime": 0,
      "pressed": false,
      "releaseTime": 0,
      "wasPressed": false,
      "wasReleased": false
    },
    {
      "holdDuration": 0,
      "holdProcessed": false,
      "isHeld": false,
      "pressTime": 0,
      "pressed": false,
      "releaseTime": 0,
      "wasPressed": false,
      "wasReleased": false
    },
    {
      "holdDuration": 0,
      "holdProcessed": false,
      "isHeld": false,
      "pressTime": 0,
      "pressed": false,
      "releaseTime": 0,
      "wasPressed": false,
      "wasReleased": false
    },
    {
      "holdDuration": 0,
      "holdProcessed": false,
      "isHeld": false,
      "pressTime": 0,
      "pressed": false,
      "releaseTime": 0,
      "wasPressed": false,
      "wasReleased": false
    },
    {
      "holdDuration": 0,
      "holdProcessed": false,
      "isHeld": false,
      "pressTime": 0,
      "pressed": false,
      "releaseTime": 0,
      "wasPressed": false,
      "wasReleased": false
    },
    {
      "holdDuration": 0,
      "holdProcessed": false,
      "isHeld": false,
      "pressTime": 0,
      "pressed": false,
      "releaseTime": 0,
      "wasPressed": false,
      "wasReleased": false
    },
    {
      "holdDuration": 0,
      "holdProcessed": false,
      "isHeld": false,
      "pressTime": 0,
      "pressed": false,
      "releaseTime": 0,
      "wasPressed": false,
      "wasReleased": false
    },
    {
      "holdDuration": 0,
      "holdProcessed": false,
      "isHeld": false,
      "pressTime": 0,
      "pressed": false,
      "releaseTime": 0,
      "wasPressed": false,
      "wasReleased": false
    },
    {
      "holdDuration": 0,
      "holdProcessed": false,
      "isHeld": false,
      "pressTime": 0,
      "pressed": false,
      "releaseTime": 0,
      "wasPressed": false,
      "wasReleased": false
    },
    {
      "holdDuration": 0,
      "holdProcessed": false,
      "isHeld": false,
      "pressTime": 0,
      "pressed": false,
      "releaseTime": 0,
      "wasPressed": false,
      "wasReleased": false
    },
    {
      "holdDuration": 0,
      "holdProcessed": false,
      "isHeld": false,
      "pressTime": 0,
      "pressed": false,
      "releaseTime": 0,
      "wasPressed": false,
      "wasReleased": false
    },
    {
      "holdDuration": 0,
      "holdProcessed": false,
      "isHeld": false,
      "pressTime": 0,
      "pressed": false,
      "releaseTime": 0,
      "wasPressed": false,
      "wasReleased": false
    },
    {
      "holdDuration": 0,
      "holdProcessed": false,
      "isHeld": false,
      "pressTime": 0,
      "pressed": false,
      "releaseTime": 0,
      "wasPressed": false,
      "wasReleased": false
    },
    {
      "holdDuration": 0,
      "holdProcessed": false,
      "isHeld": false,
      "pressTime": 0,
      "pressed": false,
      "releaseTime": 0,
      "wasPressed": false,
      "wasReleased": false
    },
    {
      "holdDuration": 0,
      "holdProcessed": false,
      "isHeld": false,
      "pressTime": 0,
      "pressed": false,
      "releaseTime": 0,
      "wasPressed": false,
      "wasReleased": false
    },
    {
      "holdDuration": 0,
      "holdProcessed": false,
      "isHeld": false,
      "pressTime": 0,
      "pressed": false,
      "releaseTime": 0,
      "wasPressed": false,
      "wasReleased": false
    },
    {
      "holdDuration": 0,
      "holdProcessed": false,
      "isHeld": false,
      "pressTime": 0,
      "pressed": false,
      "releaseTime": 0,
      "wasPressed": false,
      "wasReleased": false
    },
    {
      "holdDuration": 0,
      "holdProcessed": false,
      "isHeld": false,
      "pressTime": 0,
      "pressed": false,
      "releaseTime": 0,
      "wasPressed": false,
      "wasReleased": false
    },
    {
      "holdDuration": 0,
      "holdProcessed": false,
      "isHeld": false,
      "pressTime": 0,
      "pressed": false,
      "releaseTime": 0,
      "wasPressed": false,
      "wasReleased": false
    },
    {
      "holdDuration": 0,
      "holdProcessed": false,
      "isHeld": false,
      "pressTime": 0,
      "pressed": false,
      "releaseTime": 0,
      "wasPressed": false,
      "wasReleased": false
    },
    {
      "holdDuration": 0,
      "holdProcessed": false,
      "isHeld": false,
      "pressTime": 0,
      "pressed": false,
      "releaseTime": 0,
      "wasPressed": false,
      "wasReleased": false
    },
    {
      "holdDuration": 0,
      "holdProcessed": false,
      "isHeld": false,
      "pressTime": 0,
      "pressed": false,
      "releaseTime": 0,
      "wasPressed": false,
      "wasReleased": false
    },
    {
      "holdDuration": 0,
      "holdProcessed": false,
      "isHeld": false,
      "pressTime": 0,
      "pressed": false,
      "releaseTime": 0,
      "wasPressed": false,
      "wasReleased": false
    },
    {
      "holdDuration": 0,
      "holdProcessed": false,
      "isHeld": false,
      "pressTime": 0,
      "pressed": false,
      "releaseTime": 0,
      "wasPressed": false,
      "wasReleased": false
    },
    {
      "holdDuration": 0,
      "holdProcessed": false,
      "isHeld": false,
      "pressTime": 0,
      "pressed": false,
      "releaseTime": 0,
      "wasPressed": false,
      "wasReleased": false
    },
    {
      "holdDuration": 0,
      "holdProcessed": false,
      "isHeld": false,
      "pressTime": 0,
      "pressed": false,
      "releaseTime": 0,
      "wasPressed": false,
      "wasReleased": false
    },
    {
      "holdDuration": 0,
      "holdProcessed": false,
      "isHeld": false,
      "pressTime": 0,
      "pressed": false,
      "releaseTime": 0,
      "wasPressed": false,
      "wasReleased": false
    },
    {
      "holdDuration": 0,
      "holdProcessed": false,
      "isHeld": false,
      "pressTime": 0,
      "pressed": false,
      "releaseTime": 0,
      "wasPressed": false,
      "wasReleased": false
    },
    {
      "holdDuration": 0,
      "holdProcessed": false,
      "isHeld": false,
      "pressTime": 0,
      "pressed": false,
      "releaseTime": 0,
      "wasPressed": false,
      "wasReleased": false
    }
  ],
  "parameterLockMode": {
    "active": false,
    "heldStep": 255,
    "heldTrack": 255
  },
  "parameterLocks": [
    {
      "activeLocks": 0,
      "inUse": false,
      "length": 12,
      "noteOffset": 0,
      "stepIndex": 255,
      "trackIndex": 255,
      "velocity": 100
    },
    {
      "activeLocks": 0,
      "inUse": false,
      "length": 12,
      "noteOffset": 0,
      "stepIndex": 255,
      "trackIndex": 255,
      "velocity": 100
    },
    {
      "activeLocks": 0,
      "inUse": false,
      "length": 12,
      "noteOffset": 0,
      "stepIndex": 255,
      "trackIndex": 255,
      "velocity": 100
    },
    {
      "activeLocks": 0,
      "inUse": false,
      "length": 12,
      "noteOffset": 0,
      "stepIndex": 255,
      "trackIndex": 255,
      "velocity": 100
    },
    {
      "activeLocks": 0,
      "inUse": false,
      "length": 12,
      "noteOffset": 0,
      "stepIndex": 255,
      "trackIndex": 255,
      "velocity": 100
    },
    {
      "activeLocks": 0,
      "inUse": false,
      "length": 12,
      "noteOffset": 0,
      "stepIndex": 255,
      "trackIndex": 255,
      "velocity": 100
    },
    {
      "activeLocks": 0,
      "inUse": false,
      "length": 12,
      "noteOffset": 0,
      "stepIndex": 255,
      "trackIndex": 255,
      "velocity": 100
    },
    {
      "activeLocks": 0,
      "inUse": false,
      "length": 12,
      "noteOffset": 0,
      "stepIndex": 255,
      "trackIndex": 255,
      "velocity": 100
    },
    {
      "activeLocks": 0,
      "inUse": false,
      "length": 12,
      "noteOffset": 0,
      "stepIndex": 255,
      "trackIndex": 255,
      "velocity": 100
    },
    {
      "activeLocks": 0,
      "inUse": false,
      "length": 12,
      "noteOffset": 0,
      "stepIndex": 255,
      "trackIndex": 255,
      "velocity": 100
    },
    {
      "activeLocks": 0,
      "inUse": false,
      "length": 12,
      "noteOffset": 0,
      "stepIndex": 255,
      "trackIndex": 255,
      "velocity": 100
    },
    {
      "activeLocks": 0,
      "inUse": false,
      "length": 12,
      "noteOffset": 0,
      "stepIndex": 255,
      "trackIndex": 255,
      "velocity": 100
    },
    {
      "activeLocks": 0,
      "inUse": false,
      "length": 12,
      "noteOffset": 0,
      "stepIndex": 255,
      "trackIndex": 255,
      "velocity": 100
    },
    {
      "activeLocks": 0,
      "inUse": false,
      "length": 12,
      "noteOffset": 0,
      "stepIndex": 255,
      "trackIndex": 255,
      "velocity": 100
    },
    {
      "activeLocks": 0,
      "inUse": false,
      "length": 12,
      "noteOffset": 0,
      "stepIndex": 255,
      "trackIndex": 255,
      "velocity": 100
    },
    {
      "activeLocks": 0,
      "inUse": false,
      "length": 12,
      "noteOffset": 0,
      "stepIndex": 255,
      "trackIndex": 255,
      "velocity": 100
    },
    {
      "activeLocks": 0,
      "inUse": false,
      "length": 12,
      "noteOffset": 0,
      "stepIndex": 255,
      "trackIndex": 255,
      "velocity": 100
    },
    {
      "activeLocks": 0,